"id","title","description","price","count"
"9c745981-6bce-4f0d-a653-26f1f9dc98b6","Tyre Inflation Kit","A compact and portable tyre inflation kit, for maintaining optimal tyre pressure.","25.99","10"
"fb217bc5-b224-4af5-9f86-f35762ac6cb1","Steering Wheel Cover","Comfortable hand-grip steering wheel cover, can maintain a secure hold on the wheel.","17.99","15"
"e5abe2a0-34ed-41c8-bfbf-e8df3e6beec2","Floor Mat Set","Rugged and waterproof set of floor mats designed to keep your car's floors clean and durable.","29.99","20"
"e31f2a98-0591-4538-b690-0dc7b4945bc7","Car Charger","Multi-port USB car charger, for simultaneous charging of multiple devices.","14.99","25"
"aa3d4cc0-bf21-4a54-aa3e-6732d6ee77aa","Car Wax","High-quality car wax that provides a glossy finish and protects your car paint.","19.99","30"
